item_id,name,sale_price,short_description,long_description,images,stock,upc
23878978,Miabella 1/4 Carat T.G.W. Created White Sapphire and 1/10 Carat T.W. Sterling Silver Infinity Engagement Ring,64.99,"Delicate beauty makes this round-cut Created White Sapphire and Diamond Accent Engagement Ring a striking, yet sincere declaration of your love. Crafted in sterling silver with an elegant cross-over band, the ring showcases a brilliant round-cut, prong-set created white sapphire (3.5mm) at its center. Twenty round-cut, prong-set diamonds (G-H, I2-I3) adorn the band, lending an exquisite sparkle.","Delicate beauty makes this round-cut Created White Sapphire and Diamond Accent Engagement Ring a striking, yet sincere declaration of your love. Crafted in sterling silver with an elegant cross-over band, the ring showcases a brilliant round-cut, prong-set created white sapphire (3.5mm) at its center. Twenty round-cut, prong-set diamonds (G-H, I2-I3) adorn the band, lending an exquisite sparkle.","['https://i5.walmartimages.com/asr/2a8b10d3-0f27-4144-8f24-e4d145e89e94_1.f7edea7c3ab32834a9da42b168aeccff.jpeg?odnHeight=450&odnWidth=450&odnBg=FFFFFF', 'https://i5.walmartimages.com/asr/781d87d3-572b-4675-bb77-4130145dc8e0_1.a2c09a82784d6927d8c54c9f34791a9a.jpeg?odnHeight=450&odnWidth=450&odnBg=FFFFFF', 'https://i5.walmartimages.com/asr/938ff5ba-b6b8-4a3a-94ce-45a1cac38536_1.7e99beeb0d28811a2ddaecdd25fd90dd.jpeg?odnHeight=450&odnWidth=450&odnBg=FFFFFF', 'https://i5.walmartimages.com/asr/427d6c50-c4e7-4852-a531-99cd00a26d01_1.ae2c6c23fcb6e508b5f9aac0e928b7ea.jpeg?odnHeight=450&odnWidth=450&odnBg=FFFFFF']",Available,70851279054.0
21644536,Miabella 1-7/8 Carat T.G.W. White Sapphire Sterling Silver Filigree Engagement Ring,55.0,"Say ""I love you"" with this unique and magnificent engagement ring. A vintage inspired design with round-cut, lab-created white sapphire gemstones makes this ring the perfect one. The unique vintage design is sure to attract compliments and turn heads!","Say ""I love you"" with this unique and magnificent engagement ring. A vintage inspired design with round-cut, lab-created white sapphire gemstones makes this ring the perfect one. The unique vintage design is sure to attract compliments and turn heads!","['https://i5.walmartimages.com/asr/c3a61c8e-8d05-4716-ba2a-a2cbd865cd6e_1.f8f1f21d4166c0a9b20b1d8a264eb21f.jpeg?odnHeight=450&odnWidth=450&odnBg=FFFFFF', 'https://i5.walmartimages.com/asr/97ad1395-30ce-49d5-94de-0b390ba56ab6_1.2ea70ce81bccb98d3d558422c5fd7b34.jpeg?odnHeight=450&odnWidth=450&odnBg=FFFFFF', 'https://i5.walmartimages.com/asr/282557dc-22fc-4c21-8ec3-95c239172aa5_1.3ac69c76c22b60a864aa33118404ea6f.jpeg?odnHeight=450&odnWidth=450&odnBg=FFFFFF', 'https://i5.walmartimages.com/asr/ae599a33-5c13-4d5a-8bb5-a3eb9d3b4b56_1.c88eace22d37c29956c0d7ccbd455edc.jpeg?odnHeight=450&odnWidth=450&odnBg=FFFFFF', 'https://i5.walmartimages.com/asr/ec884f63-6a3c-440c-8332-b705021545ab_1.7e99beeb0d28811a2ddaecdd25fd90dd.jpeg?odnHeight=450&odnWidth=450&odnBg=FFFFFF']",Available,70663902058.0
40487290,Miabella 1/5 Carat T.W. Diamond Sterling Silver Double Halo Split Shank Engagement Ring,184.0,"Show her your love and devotion and say ""I love you"" with this exquisite Miabella Double Halo Engagement Ring. It is finely crafted in sturdy and durable sterling silver and features sparkling diamonds. This 1/5 carat T.W. diamond engagement ring showcases a double-band look crowned with a double halo that is studded with a total of 35 round-cut, prong and buttercup-set diamonds (J-K, I3). It features a detailed and feminine design and the double band look gives this ring an elegant, modern allure. This lustrous sterling silver engagement ring is specially designed to fit snugly against a wedding ring of her choice.","Show her your love and devotion and say ""I love you"" with this exquisite Miabella Double Halo Engagement Ring. It is finely crafted in sturdy and durable sterling silver and features sparkling diamonds. This 1/5 carat T.W. diamond engagement ring showcases a double-band look crowned with a double halo that is studded with a total of 35 round-cut, prong and buttercup-set diamonds (J-K, I3). It features a detailed and feminine design and the double band look gives this ring an elegant, modern allure. This lustrous sterling silver engagement ring is specially designed to fit snugly against a wedding ring of her choice.","['https://i5.walmartimages.com/asr/9310ec57-64a5-4e26-b3b4-0601797686e1_2.db93f88ae1ccc05b4035cfe1cf1def2a.jpeg?odnHeight=450&odnWidth=450&odnBg=FFFFFF', 'https://i5.walmartimages.com/asr/9e7b64ac-cfea-4750-a06f-003c37cb8f20_1.f21e9398f3540198ef684bfa8c5640b0.jpeg?odnHeight=450&odnWidth=450&odnBg=FFFFFF', 'https://i5.walmartimages.com/asr/d6a27669-9496-4f17-bdb2-1d8504a1c6a0_1.cb660f5f087ac435b2aa7fde89acc8be.jpeg?odnHeight=450&odnWidth=450&odnBg=FFFFFF', 'https://i5.walmartimages.com/asr/23bbd92e-892f-4072-b9b3-1b6d23a32c73_1.4b9db108fb2e3cee33790ca34c634dfe.jpeg?odnHeight=450&odnWidth=450&odnBg=FFFFFF', 'https://i5.walmartimages.com/asr/f4af1d17-0749-4bc3-b443-6d6e4a0d2397_1.055f7df003df5423cc337bca863c6684.jpeg?odnHeight=450&odnWidth=450&odnBg=FFFFFF', 'https://i5.walmartimages.com/asr/448e5aa8-0a80-42e1-b668-6d99fdd87b72_1.2e153a545fc85d1da60e5f02bc61b8ef.jpeg?odnHeight=450&odnWidth=450&odnBg=FFFFFF', 'https://i5.walmartimages.com/asr/a4774d78-f8d1-41b9-ace2-2c26bb310cef_2.200de0ea291c129189476e31fcba02cd.jpeg?odnHeight=450&odnWidth=450&odnBg=FFFFFF', 'https://i5.walmartimages.com/asr/4b318741-fcbd-4d90-8872-d9496601e0a7_1.daed00766d4cae84cd6b7dfccfb71cc9.jpeg?odnHeight=450&odnWidth=450&odnBg=FFFFFF', 'https://i5.walmartimages.com/asr/740868d5-9762-42dd-9ab4-585b2581806c_1.7e99beeb0d28811a2ddaecdd25fd90dd.jpeg?odnHeight=450&odnWidth=450&odnBg=FFFFFF']",Available,750005459746.0
20656732,Miabella 1/4 Carat T.G.W. Created White Sapphire and Diamond-Accent Sterling Silver Heart Promise Ring,53.99,"<p>Take her breath away as you present that special someone with this 1/4 Carat T.G.W. Diamond-Accent Engagement Ring. The double crossover shank adds a touch of simple sophistication to this sterling silver engagement ring, while the heart-shaped white sapphire dazzles. This white sapphire engagement ring was lab-created and is set in a three-prong setting surrounded by five genuine diamond accents on each side for added sparkle.</p>","<p>Take her breath away as you present that special someone with this 1/4 Carat T.G.W. Diamond-Accent Engagement Ring. The double crossover shank adds a touch of simple sophistication to this sterling silver engagement ring, while the heart-shaped white sapphire dazzles. This white sapphire engagement ring was lab-created and is set in a three-prong setting surrounded by five genuine diamond accents on each side for added sparkle.</p>","['https://i5.walmartimages.com/asr/9c588754-e7fb-4acc-b50a-18b0233e0722_1.c4f5139dd9f5f2b27bb322b1f8908b49.jpeg?odnHeight=450&odnWidth=450&odnBg=FFFFFF', 'https://i5.walmartimages.com/asr/9cc3a516-ea3d-4473-8e4e-9868f84bf5ef_1.f70a98f3da69237625f791a570b18030.jpeg?odnHeight=450&odnWidth=450&odnBg=FFFFFF', 'https://i5.walmartimages.com/asr/cfce6fd1-ba41-458e-9fd1-622230608864_1.7e99beeb0d28811a2ddaecdd25fd90dd.jpeg?odnHeight=450&odnWidth=450&odnBg=FFFFFF', 'https://i5.walmartimages.com/asr/6929082a-eff7-441f-b598-054ce2e23bc5_1.df0a35585e842432afec36741ca909b2.jpeg?odnHeight=450&odnWidth=450&odnBg=FFFFFF', 'https://i5.walmartimages.com/asr/67c80652-4ee7-4258-bee0-3cb524b0fa9e_1.a08268703f63e48bfebeb77dfd4c23dc.jpeg?odnHeight=450&odnWidth=450&odnBg=FFFFFF', 'https://i5.walmartimages.com/asr/bfe5f83c-c749-4f7d-85bb-87ef094b3749_1.e146d09ba66784d7b928a001d3c8a3c2.jpeg?odnHeight=450&odnWidth=450&odnBg=FFFFFF']",Available,70539252072.0
38437382,Miabella 1/5 Carat T.W. Diamond Sterling Silver Halo Bridal Set,185.99,"Express your commitment to a future together with this exquisite sterling silver Miabella Diamond Bridal Set. The engagement ring sparkles with a round-cut, prong-set white diamond at center and 16 round-cut, pave-set white diamonds with four round-cut, prong-set white diamonds along the band. The companion wedding band is a perfect match with five icy round-cut, prong-set white diamonds as well.","Express your commitment to a future together with this exquisite sterling silver Miabella Diamond Bridal Set. The engagement ring sparkles with a round-cut, prong-set white diamond at center and 16 round-cut, pave-set white diamonds with four round-cut, prong-set white diamonds along the band. The companion wedding band is a perfect match with five icy round-cut, prong-set white diamonds as well.","['https://i5.walmartimages.com/asr/dba593bc-99aa-454f-9601-73ef3312ae1c_1.8fdb417b141572e5d27d76e3964f359c.jpeg?odnHeight=450&odnWidth=450&odnBg=FFFFFF', 'https://i5.walmartimages.com/asr/edae9df6-89be-48cb-8902-41ec11c9118a_1.62b1691acf66ce2086621c00ca66aa31.jpeg?odnHeight=450&odnWidth=450&odnBg=FFFFFF', 'https://i5.walmartimages.com/asr/460e7c7f-f7ad-46fb-a417-5c325f2b6cad_1.d5fe05caefad5e06fb08a775d10557ec.jpeg?odnHeight=450&odnWidth=450&odnBg=FFFFFF', 'https://i5.walmartimages.com/asr/f716797c-63e9-485d-988f-a9f5394b8390_1.044303653c8dcaeef707d7fc445f0458.jpeg?odnHeight=450&odnWidth=450&odnBg=FFFFFF', 'https://i5.walmartimages.com/asr/ed2c9ba1-583f-4a01-8f54-a405ccc5fe1a_1.916c9780a71f6ab65625c359c90d7b7c.jpeg?odnHeight=450&odnWidth=450&odnBg=FFFFFF', 'https://i5.walmartimages.com/asr/942f3ddb-3167-46eb-b040-cdadae4e6507_1.17ccf07fd00067141ac4308c8b4d375c.jpeg?odnHeight=450&odnWidth=450&odnBg=FFFFFF', 'https://i5.walmartimages.com/asr/dc6c9c15-bda9-46f6-85e1-9714b86b65bd_1.3052e4742c00582982c6ef1ccc81b564.jpeg?odnHeight=450&odnWidth=450&odnBg=FFFFFF', 'https://i5.walmartimages.com/asr/6dac5a10-51c6-41ef-8f8c-f7145d91c053_1.f59af20459e2e847aa4487ec5db558a4.jpeg?odnHeight=450&odnWidth=450&odnBg=FFFFFF', 'https://i5.walmartimages.com/asr/dc7826a2-f03a-49b6-929f-9570d9796066_1.f520d5176f4e2cb4366d2b057f6611e1.jpeg?odnHeight=450&odnWidth=450&odnBg=FFFFFF', 'https://i5.walmartimages.com/asr/9f9ed24e-d364-4e7c-97ed-8c7000ef4103_1.8ba7b205c7a88ed8c7294f2bf5c359b4.jpeg?odnHeight=450&odnWidth=450&odnBg=FFFFFF']",Available,750004056816.0
31962053,Miabella 1-1/3 Carat T.G.W. Created White Sapphire and Diamond-Accent 10kt White Gold Three Stone Engagement Ring,179.99,"Watch her eyes light up when you give her this stunning Created White Sapphire and Diamond Accent Three-Stone Engagement Ring. Crafted in lustrous white gold, the engagement ring is prong set with round created white sapphires (6mm and 3mm) at the center and accented with 10 round, pave-set diamonds (G-H, I2-I3) along the band.","Watch her eyes light up when you give her this stunning Created White Sapphire and Diamond Accent Three-Stone Engagement Ring. Crafted in lustrous white gold, the engagement ring is prong set with round created white sapphires (6mm and 3mm) at the center and accented with 10 round, pave-set diamonds (G-H, I2-I3) along the band.","['https://i5.walmartimages.com/asr/03160ad7-d678-4524-b7a2-2cc78e9f88d2_1.cb63e10b4292071e18cbd8dc35ec1765.jpeg?odnHeight=450&odnWidth=450&odnBg=FFFFFF', 'https://i5.walmartimages.com/asr/3340569c-85f8-426b-be8c-8e03b5220405_1.63fb53ee5d6049527db786d6e77ff621.jpeg?odnHeight=450&odnWidth=450&odnBg=FFFFFF', 'https://i5.walmartimages.com/asr/c5a8bbfc-11d2-4342-a914-4588fa423cc0_1.62b1691acf66ce2086621c00ca66aa31.jpeg?odnHeight=450&odnWidth=450&odnBg=FFFFFF', 'https://i5.walmartimages.com/asr/a0104a30-388a-4ea5-a67e-90150cf19ebf_1.45466336120674d1412727a82a583cec.jpeg?odnHeight=450&odnWidth=450&odnBg=FFFFFF', 'https://i5.walmartimages.com/asr/b503728b-b721-4217-8d26-020fa23ddf46_1.5e32d90afe339f22714f449bae3a68aa.jpeg?odnHeight=450&odnWidth=450&odnBg=FFFFFF', 'https://i5.walmartimages.com/asr/42f494a2-c003-4dab-864b-6f826edd1f18_1.7e99beeb0d28811a2ddaecdd25fd90dd.jpeg?odnHeight=450&odnWidth=450&odnBg=FFFFFF']",Available,70936673050.0
34193068,Miabella 1/4 Carat T.W. Diamond Sterling Silver Halo Bridal Set,188.99,"A beautiful symbol of the life you'll share, this Round-cut Diamond Halo Bridal Set from the Miabella collection is crafted in lustrous sterling silver. Featuring a haloed-square center prong and pave set with icy round-cut diamonds, the engagement ring is further adorned with round, pave-set diamonds along the band. The companion wedding band is a perfect match, pave set with sparkling round diamonds as well. Total diamond count is 52.","A beautiful symbol of the life you'll share, this Round-cut Diamond Halo Bridal Set from the Miabella collection is crafted in lustrous sterling silver. Featuring a haloed-square center prong and pave set with icy round-cut diamonds, the engagement ring is further adorned with round, pave-set diamonds along the band. The companion wedding band is a perfect match, pave set with sparkling round diamonds as well. Total diamond count is 52.","['https://i5.walmartimages.com/asr/a2e1b96e-d5b1-42d4-9fd4-b6d2b17903d8_1.5baf13956999eb46f7cfb8a50c26df17.jpeg?odnHeight=450&odnWidth=450&odnBg=FFFFFF', 'https://i5.walmartimages.com/asr/e5aae6b7-ea8d-467a-a167-06f0053df451_1.fa2d0dc325d01e3cbb76c592596aec9f.jpeg?odnHeight=450&odnWidth=450&odnBg=FFFFFF', 'https://i5.walmartimages.com/asr/b2cf7341-36b7-47af-9bd2-2bfbb55edb04_1.3499acbdbdae6b6ac7601ce4ba191ff3.jpeg?odnHeight=450&odnWidth=450&odnBg=FFFFFF', 'https://i5.walmartimages.com/asr/74040d0f-cc66-456a-88e9-4b0e2cefd7bf_1.3f558443c9cc7278a289d866c071d9cc.jpeg?odnHeight=450&odnWidth=450&odnBg=FFFFFF', 'https://i5.walmartimages.com/asr/a5f288f2-67c8-4d4a-8497-d5637fd10dc8_1.4b3a4524fd01c77b242f49f6469f8459.jpeg?odnHeight=450&odnWidth=450&odnBg=FFFFFF']",Available,750001582424.0
23879025,Miabella 3/8 Carat T.G.W. Princess-Cut Created White Sapphire and Diamond-Accent Sterling Silver Cross-Over Engagement Ring,51.99,"Make your intentions clear with this sterling silver Princess-Cut Created White Sapphire and Diamond Accent Promise Ring. The ring boasts an eye-catching cross-over band design, prong set with an icy princess-cut created white sapphire (4mm). Two round-cut, prong-set diamond accents (G-H, I3) adorn each side for an added sparkle.","Make your intentions clear with this sterling silver Princess-Cut Created White Sapphire and Diamond Accent Promise Ring. The ring boasts an eye-catching cross-over band design, prong set with an icy princess-cut created white sapphire (4mm). Two round-cut, prong-set diamond accents (G-H, I3) adorn each side for an added sparkle.","['https://i5.walmartimages.com/asr/cee23e02-48c3-4822-9a0c-c7925773c4c2_1.6e2ed2994f407ed86af643c21565a2d9.jpeg?odnHeight=450&odnWidth=450&odnBg=FFFFFF', 'https://i5.walmartimages.com/asr/a736dde9-6e44-4132-94ce-baa5d05be9a4_1.32145b82a823ad08e2c988d5b2461e77.jpeg?odnHeight=450&odnWidth=450&odnBg=FFFFFF', 'https://i5.walmartimages.com/asr/0ab518fd-a66a-49a2-ad46-376a3464af25_1.255b3128fd577e31687829b8f5cde8f1.jpeg?odnHeight=450&odnWidth=450&odnBg=FFFFFF', 'https://i5.walmartimages.com/asr/5bb81ced-f8bc-4e4a-9b89-425cb310ce5b_1.daed00766d4cae84cd6b7dfccfb71cc9.jpeg?odnHeight=450&odnWidth=450&odnBg=FFFFFF', 'https://i5.walmartimages.com/asr/96b7d269-9253-4f7e-a0f4-7357c338e31f_1.ee37c90dea1bc5f53d92b0bcd96ba40c.jpeg?odnHeight=450&odnWidth=450&odnBg=FFFFFF', 'https://i5.walmartimages.com/asr/cbca2684-c652-45ad-bec8-0d3b1dd4fdd0_1.7e99beeb0d28811a2ddaecdd25fd90dd.jpeg?odnHeight=450&odnWidth=450&odnBg=FFFFFF', 'https://i5.walmartimages.com/asr/35c8402d-97ae-46d3-84ab-4fa4e17d991d_1.ebe3de10f205a20279cacbcd46f9975f.jpeg?odnHeight=450&odnWidth=450&odnBg=FFFFFF']",Available,70851323054.0
38437279,Miabella 1/4 Carat Diamond Sterling Silver Double Halo Bridal Set,191.99,"Express your commitment to a future together with this exquisite sterling silver Miabella Diamond Bridal Set. The engagement ring sparkles with a round-cut, prong-set white diamond at center and eight round-cut, prong-set white diamonds with 15 round-cut, buttercup-set white diamonds along the band. The companion wedding band is a perfect match with 26 icy round-cut, buttercup-set white diamonds as well.","Express your commitment to a future together with this exquisite sterling silver Miabella Diamond Bridal Set. The engagement ring sparkles with a round-cut, prong-set white diamond at center and eight round-cut, prong-set white diamonds with 15 round-cut, buttercup-set white diamonds along the band. The companion wedding band is a perfect match with 26 icy round-cut, buttercup-set white diamonds as well.","['https://i5.walmartimages.com/asr/44311619-a5a8-475e-baaf-5a2ed944bd39_1.8aee2995d0ef388e5c3af1d9b59c24ae.jpeg?odnHeight=450&odnWidth=450&odnBg=FFFFFF', 'https://i5.walmartimages.com/asr/8f9d785a-128b-4f8f-922e-ce97da400e32_1.8356af5748eefa7c51b5a223c4bec734.jpeg?odnHeight=450&odnWidth=450&odnBg=FFFFFF', 'https://i5.walmartimages.com/asr/b4ef0026-0e04-4d91-accf-4b605c31eff5_1.f21e9398f3540198ef684bfa8c5640b0.jpeg?odnHeight=450&odnWidth=450&odnBg=FFFFFF', 'https://i5.walmartimages.com/asr/622786ee-633e-4e93-9670-34c3e8202abe_1.62b1691acf66ce2086621c00ca66aa31.jpeg?odnHeight=450&odnWidth=450&odnBg=FFFFFF', 'https://i5.walmartimages.com/asr/9ae6ad42-c4ce-400b-9c70-95baaf2a00a6_1.62ad60129944a82be8794ab25b74ae04.jpeg?odnHeight=450&odnWidth=450&odnBg=FFFFFF', 'https://i5.walmartimages.com/asr/b7c6adcf-91b4-46e2-a82f-b991ca8d87ca_1.7e99beeb0d28811a2ddaecdd25fd90dd.jpeg?odnHeight=450&odnWidth=450&odnBg=FFFFFF', 'https://i5.walmartimages.com/asr/33d076ad-76ef-4870-98f5-6d8729aa9d4a_1.daed00766d4cae84cd6b7dfccfb71cc9.jpeg?odnHeight=450&odnWidth=450&odnBg=FFFFFF', 'https://i5.walmartimages.com/asr/ddcb2215-801a-41ad-b015-d9672d650a33_1.408991122ed34afee847ea9e4cee9bb9.jpeg?odnHeight=450&odnWidth=450&odnBg=FFFFFF', 'https://i5.walmartimages.com/asr/8920d4fb-0763-48fe-9833-e92e0bfb2e3b_1.38a038b7ddd6618e7faa9984d213ecbd.jpeg?odnHeight=450&odnWidth=450&odnBg=FFFFFF']",Available,750004057806.0
37159844,Miabella 1/4 Carat T.G.W. Created White Sapphire and Diamond-Accent 10kt White Gold Infinity Engagement Ring,181.99,"Featuring a classic design this Miabella created white sapphire and diamond cross-over engagement ring will be perfect for your special one. Crafted in lustrous white gold, the ring features a round-cut (3.5mm) created white sapphire gemstone in the center and 20 round-cut, prong-set diamond accents (G-H, I2-I3) along the sides.","Featuring a classic design this Miabella created white sapphire and diamond cross-over engagement ring will be perfect for your special one. Crafted in lustrous white gold, the ring features a round-cut (3.5mm) created white sapphire gemstone in the center and 20 round-cut, prong-set diamond accents (G-H, I2-I3) along the sides.","['https://i5.walmartimages.com/asr/d51e046d-7e28-4532-8a78-0de798804413_1.b667c34a1aeb88ea7a454a4ec0c03de4.jpeg?odnHeight=450&odnWidth=450&odnBg=FFFFFF', 'https://i5.walmartimages.com/asr/6cd6b717-8b83-4da5-8034-a8e125b77d24_1.62b1691acf66ce2086621c00ca66aa31.jpeg?odnHeight=450&odnWidth=450&odnBg=FFFFFF', 'https://i5.walmartimages.com/asr/e98a40ca-dd90-4a85-81bf-827d8597055c_1.b78100f6474f07189f8e4766782f5368.jpeg?odnHeight=450&odnWidth=450&odnBg=FFFFFF', 'https://i5.walmartimages.com/asr/d1bda232-5ee0-40de-85ca-2734f0b9ab7e_1.f68ac5d36f6b0c4bfa0669029428b7eb.jpeg?odnHeight=450&odnWidth=450&odnBg=FFFFFF', 'https://i5.walmartimages.com/asr/94f56a0e-8669-4e00-b3d3-1b1bf15b2f5a_1.7e99beeb0d28811a2ddaecdd25fd90dd.jpeg?odnHeight=450&odnWidth=450&odnBg=FFFFFF']",Available,750003176010.0
31960686,Miabella 2-3/8 Carat T.W. Created White Sapphire 10kt White Gold Solitaire Engagement Ring,154.99,"A solitaire-style engagement ring has a timeless quality to it and this Created White Sapphire Solitaire Engagement Ring is no exception. Sparkling with a dazzling round-cut, prong-set created white sapphire (8mm), this classic engagement ring is crafted in lustrous white gold.","A solitaire-style engagement ring has a timeless quality to it and this Created White Sapphire Solitaire Engagement Ring is no exception. Sparkling with a dazzling round-cut, prong-set created white sapphire (8mm), this classic engagement ring is crafted in lustrous white gold.","['https://i5.walmartimages.com/asr/c3e718f4-b65b-4d1b-bfb3-ffacd0a4d575_1.dbef8c5d98f119d5b6d6a6ab6d2cba4f.jpeg?odnHeight=450&odnWidth=450&odnBg=FFFFFF', 'https://i5.walmartimages.com/asr/48275f10-8475-4e4a-9fa8-6a1e742f01e9_1.5b8559e8ff489585b2f13fab25d5b852.jpeg?odnHeight=450&odnWidth=450&odnBg=FFFFFF', 'https://i5.walmartimages.com/asr/9a155a1a-3b88-48df-9136-2a3fded3a104_1.86d1a6aa22d0e4362da5f63b220a7276.jpeg?odnHeight=450&odnWidth=450&odnBg=FFFFFF', 'https://i5.walmartimages.com/asr/f42b3097-7e2d-4885-8529-6cc9d462d516_1.7e99beeb0d28811a2ddaecdd25fd90dd.jpeg?odnHeight=450&odnWidth=450&odnBg=FFFFFF', 'https://i5.walmartimages.com/asr/291253ad-f81d-4e26-8479-f2d06fb19eb8_1.7297448f17e6ef13d29d21a0a8bfa605.jpeg?odnHeight=450&odnWidth=450&odnBg=FFFFFF', 'https://i5.walmartimages.com/asr/8a4fa6b4-7938-4158-b56f-df7bb4e053bf_1.62b1691acf66ce2086621c00ca66aa31.jpeg?odnHeight=450&odnWidth=450&odnBg=FFFFFF']",Available,70935461054.0
20656692,Miabella 1/3 Carat T.G.W. Created White Sapphire and Diamond-Accent Sterling Silver Engagement Ring,51.99,"As your love grows, pledge your commitment with this exquisite ring. Fashioned in sleek sterling silver, this elegant ring features a brilliant created white sapphire center stone flanked by smaller created white sapphires and diamond accents.","As your love grows, pledge your commitment with this exquisite ring. Fashioned in sleek sterling silver, this elegant ring features a brilliant created white sapphire center stone flanked by smaller created white sapphires and diamond accents.","['https://i5.walmartimages.com/asr/da39c3cc-d08e-495c-89c2-df1f5322cb05_1.e25471b7076f03b9769729ce4e2476af.jpeg?odnHeight=450&odnWidth=450&odnBg=FFFFFF', 'https://i5.walmartimages.com/asr/34373c7a-ced9-49d5-a034-bbc401c2ba1d_1.7e99beeb0d28811a2ddaecdd25fd90dd.jpeg?odnHeight=450&odnWidth=450&odnBg=FFFFFF', 'https://i5.walmartimages.com/asr/f8e8a84b-d710-404e-be4b-a9c538c8832b_1.fa9ac40188cefef2490d514b12e214c1.jpeg?odnHeight=450&odnWidth=450&odnBg=FFFFFF', 'https://i5.walmartimages.com/asr/8d08f026-2be8-4827-9a99-229b47fdbf61_1.6b2c48831295dbaad1ee8bcc4f6aaa67.jpeg?odnHeight=450&odnWidth=450&odnBg=FFFFFF', 'https://i5.walmartimages.com/asr/f867dbd6-0cea-4dbe-bb54-cfac6ce3e054_1.570729de98ed2f4c00b604da94d4bc5e.jpeg?odnHeight=450&odnWidth=450&odnBg=FFFFFF']",Available,70538873070.0
38762953,Miabella 1/5 Carat T.W. Diamond Sterling Silver Halo Infinity Bridal Set,210.99,"<p>Show her how much you love her with the Miabella Sterling Silver Diamond Bridal Set. This beautiful duo is a wonderful way to make a promise to love each other forever. The Halo diamond bridal set has a sterling silver engagement ring that sparkles with a round-cut gem. The prong set stone sits right at the center and is embellished with 12 round-cut white diamonds that flow down the band. The companion wedding band in this infinity bridal set creates a wonderful compliment that is made with four matching precious stones. The total weight of the set is 1/5 carat, and the ring and band are both made from sterling silver. Give this to the one you love as a surprise when you want to pop the big question and watch her eyes light up. The Miabella Sterling Silver Diamond Bridal Set is sure to make a statement as she proudly wears it on her left ring finger.</p>","<p>Show her how much you love her with the Miabella Sterling Silver Diamond Bridal Set. This beautiful duo is a wonderful way to make a promise to love each other forever. The Halo diamond bridal set has a sterling silver engagement ring that sparkles with a round-cut gem. The prong set stone sits right at the center and is embellished with 12 round-cut white diamonds that flow down the band. The companion wedding band in this infinity bridal set creates a wonderful compliment that is made with four matching precious stones. The total weight of the set is 1/5 carat, and the ring and band are both made from sterling silver. Give this to the one you love as a surprise when you want to pop the big question and watch her eyes light up. The Miabella Sterling Silver Diamond Bridal Set is sure to make a statement as she proudly wears it on her left ring finger.</p>","['https://i5.walmartimages.com/asr/da1195ba-bf9f-464c-896b-de4967160383_1.0591f1b17131ca285e822e8def974ec6.jpeg?odnHeight=450&odnWidth=450&odnBg=FFFFFF', 'https://i5.walmartimages.com/asr/e6b2d5ae-de43-4ef0-a013-4bbc90553c84_1.7e99beeb0d28811a2ddaecdd25fd90dd.jpeg?odnHeight=450&odnWidth=450&odnBg=FFFFFF', 'https://i5.walmartimages.com/asr/26a25540-bb0d-4c3d-9bb9-1d6ebd56c262_1.94f00a34c8cd41c0633dd256e3262d44.jpeg?odnHeight=450&odnWidth=450&odnBg=FFFFFF', 'https://i5.walmartimages.com/asr/864c34e6-d6f3-4bd6-bc42-20db51b7abc7_1.62b1691acf66ce2086621c00ca66aa31.jpeg?odnHeight=450&odnWidth=450&odnBg=FFFFFF', 'https://i5.walmartimages.com/asr/96f4d115-0eea-4817-b52e-b0bfb387b0f4_1.844ed1900650d5f9c81123460e1085bf.jpeg?odnHeight=450&odnWidth=450&odnBg=FFFFFF', 'https://i5.walmartimages.com/asr/d593a315-d492-43bb-bc8a-66b7e0e4869f_1.ebdb7682fdb8f60a59b9f902a1cc6768.jpeg?odnHeight=450&odnWidth=450&odnBg=FFFFFF']",Available,750004279970.0
