item_id,name,sale_price,short_description,long_description,images,stock,upc
15718330,"Miabella 1/10 Carat T.W. Diamond Heart Sterling Silver Women's Pendant Necklace, 18",51.99,"<p>This beautiful 1/10 Carat T.W. Sterling Silver Diamond Heart Pendant is a delicate piece that will show your love and devotion. The 1/10 Carat Diamond Heart Pendant has an 18"" sterling silver chain that is connected to the solid heart, and the heart that is adorned with 21 round diamonds. This dainty sterling silver pendant can be worn on any occasion and will make a thoughtful gift for the special lady in your life.</p>","<p>This beautiful 1/10 Carat T.W. Sterling Silver Diamond Heart Pendant is a delicate piece that will show your love and devotion. The 1/10 Carat Diamond Heart Pendant has an 18"" sterling silver chain that is connected to the solid heart, and the heart that is adorned with 21 round diamonds. This dainty sterling silver pendant can be worn on any occasion and will make a thoughtful gift for the special lady in your life.</p>","['https://i5.walmartimages.com/asr/1da3000a-d8e3-4a73-a393-747d9c1c49cf_1.551a6890dec51a65aab2ada2b7016506.jpeg?odnHeight=450&odnWidth=450&odnBg=FFFFFF', 'https://i5.walmartimages.com/asr/c89ab887-1f81-4328-803e-245cb3cd79e7_1.a285b9035a7f9b5ccadb8bc8a9f5d7cb.jpeg?odnHeight=450&odnWidth=450&odnBg=FFFFFF', 'https://i5.walmartimages.com/asr/8eda9790-8f2e-4224-88ed-c9ef21e40a23_1.b0dbecb50241c963b694ad7ed2a0570c.jpeg?odnHeight=450&odnWidth=450&odnBg=FFFFFF', 'https://i5.walmartimages.com/asr/baf3faf5-6b88-4f48-89db-ddddb247fd2e_1.daa398e0fe4cfd275f4132cb472530fb.jpeg?odnHeight=450&odnWidth=450&odnBg=FFFFFF']",Available,75001743782.0
31959582,"Miabella Diamond Accent 10kt Yellow Gold Heart Women's Pendant Necklace, 17",156.99,"Crafted in warm yellow gold, this Miabella Diamond Accent Heart Pendant features a slanted looped heart pave set with 14 icy round diamonds (G-H, I2-I3) on one side. The fashion pendant is attached to a 17-inch-long rope chain that secures with a spring ring clasp.","Crafted in warm yellow gold, this Miabella Diamond Accent Heart Pendant features a slanted looped heart pave set with 14 icy round diamonds (G-H, I2-I3) on one side. The fashion pendant is attached to a 17-inch-long rope chain that secures with a spring ring clasp.","['https://i5.walmartimages.com/asr/d6e8d736-0aca-4e41-a162-568a022f404d_1.b3b3e5c352a776b9edd345b703f165ed.jpeg?odnHeight=450&odnWidth=450&odnBg=FFFFFF', 'https://i5.walmartimages.com/asr/87db0fb9-777b-4a4e-be4f-976ed90d3e29_1.fb585eb49d7c77579bac7f628812712e.jpeg?odnHeight=450&odnWidth=450&odnBg=FFFFFF', 'https://i5.walmartimages.com/asr/b0d8f92c-0cae-402a-8228-a0f1398b6ec6_1.dba08ef06209990a700c912f2da34559.jpeg?odnHeight=450&odnWidth=450&odnBg=FFFFFF', 'https://i5.walmartimages.com/asr/9e71fa59-c09f-4fc6-a33c-1ebb8aad47e7_1.1c948648885fe406ad046099a9c4c3f3.jpeg?odnHeight=450&odnWidth=450&odnBg=FFFFFF', 'https://i5.walmartimages.com/asr/526bc704-4e3a-4906-8a25-1373b9ced867_1.7e0b9fe5892c07a66819d6fb0b4e95c3.jpeg?odnHeight=450&odnWidth=450&odnBg=FFFFFF', 'https://i5.walmartimages.com/asr/c97ebbd7-69ba-4062-89a2-1c31a018bea7_1.2da2009632b30fcb9809cc44a265d939.jpeg?odnHeight=450&odnWidth=450&odnBg=FFFFFF', 'https://i5.walmartimages.com/asr/57e33560-6eb0-40a6-af5e-51f743da4abf_1.0939293dba9a44dc5badeb11d09428d3.jpeg?odnHeight=450&odnWidth=450&odnBg=FFFFFF']",Available,70935652001.0
45714022,Miabella 1/8 Carat T.W. Diamond Sterling Silver Semi-Eternity Anniversary Ring,97.99,"Tell her your heart belongs to her with this stunning Miabella Diamond Sterling Silver Semi-Eternity Anniversary Ring. Crafted in lustrous sterling silver, the ring shimmers 27 round-cut, pave-set white diamonds (G-H, I2-I3) along the band. The ring is enhanced with a miligrain finish.","Tell her your heart belongs to her with this stunning Miabella Diamond Sterling Silver Semi-Eternity Anniversary Ring. Crafted in lustrous sterling silver, the ring shimmers 27 round-cut, pave-set white diamonds (G-H, I2-I3) along the band. The ring is enhanced with a miligrain finish.","['https://i5.walmartimages.com/asr/d9f540e9-b636-49c0-bc95-9e57ce890bb1_1.f3cd8f7963074b7641efe55b5c90d5f1.jpeg?odnHeight=450&odnWidth=450&odnBg=FFFFFF', 'https://i5.walmartimages.com/asr/a7d8849d-50c7-49d7-a2b1-f123a64bc244_1.bce5ac33775273ce4f9cf6d9c0283371.jpeg?odnHeight=450&odnWidth=450&odnBg=FFFFFF', 'https://i5.walmartimages.com/asr/5d627174-1a50-48d8-a259-f1f84b6422ff_1.13df0f9de023ef968815a971a0c8be52.jpeg?odnHeight=450&odnWidth=450&odnBg=FFFFFF', 'https://i5.walmartimages.com/asr/b07439e6-94e4-4230-8f24-d5b7fc51b62a_1.291aa8876732cd9d7d9c49eb48aec5cc.jpeg?odnHeight=450&odnWidth=450&odnBg=FFFFFF']",Available,750007059722.0
33593128,Miabella 1/4 Carat T.W. Diamond Sterling Silver Hoop Earrings,68.99,"The classic Miabella 1/4 Carat T.W. Diamond Sterling Silver Hoop Earrings lend your look an elegant sparkle. Simple enough for daily wear, they are neutrally colored for optimal match-ability. These lovely hoops showcase a total of 24 icy, round diamonds (J-K, I3). They are crafted in lustrous sterling silver for durable construction and feature prong-set precious stones for security. This helps add dimension and detail. They are secured with clip-in closures so you can be confident that you won't easily lose them. These diamond sterling silver earrings would make a charming gift for that special someone. Let these accessories act as a reminder of the special bond you share since she can enjoy them day after day. With a traditional hoop design, the shimmering earrings can add sparkle to nearly any outfit.","The classic Miabella 1/4 Carat T.W. Diamond Sterling Silver Hoop Earrings lend your look an elegant sparkle. Simple enough for daily wear, they are neutrally colored for optimal match-ability. These lovely hoops showcase a total of 24 icy, round diamonds (J-K, I3). They are crafted in lustrous sterling silver for durable construction and feature prong-set precious stones for security. This helps add dimension and detail. They are secured with clip-in closures so you can be confident that you won't easily lose them. These diamond sterling silver earrings would make a charming gift for that special someone. Let these accessories act as a reminder of the special bond you share since she can enjoy them day after day. With a traditional hoop design, the shimmering earrings can add sparkle to nearly any outfit.","['https://i5.walmartimages.com/asr/da64540a-bfd9-4c46-91d8-69fd5a067c0b_1.47c3aef301844ca923ff8b9e39b59991.jpeg?odnHeight=450&odnWidth=450&odnBg=FFFFFF', 'https://i5.walmartimages.com/asr/f2b7edbc-609b-4469-b421-f0cca2a1609f_1.ba67d054f4132ee66ee54893ee07d00b.jpeg?odnHeight=450&odnWidth=450&odnBg=FFFFFF', 'https://i5.walmartimages.com/asr/2c859a76-1aca-45a5-80d4-c3f718da380f_1.ebe3de10f205a20279cacbcd46f9975f.jpeg?odnHeight=450&odnWidth=450&odnBg=FFFFFF', 'https://i5.walmartimages.com/asr/4c523472-fd41-4b25-a70c-d1cfa906c4af_1.151639f03998a0c6b5eb66e80c5eeed9.jpeg?odnHeight=450&odnWidth=450&odnBg=FFFFFF']",Available,750001422270.0
33593138,"Miabella 1/10 Carat T.W. Diamond 14kt White Gold Heart Pendant, 17",161.99,"This Miabella 1/10 Carat T.W. Diamond 14kt White Gold Heart Pendant shimmers in lustrous white gold with an openwork design. The heart-shaped pendant is pronged set with 24 fiery round diamonds and is attached to a rope chain secured with a spring ring clasp. Your loved one is sure to remember you fondly each time this pendant jewelry is worn. The 17"" long chain pendant is a convenient length to complement many different necklines and styles. It is a sweet reminder to the wearer that you truly care. It makes a thoughtful gift to that special person and it is a lovely additional accessory to a jewelry collection.","This Miabella 1/10 Carat T.W. Diamond 14kt White Gold Heart Pendant shimmers in lustrous white gold with an openwork design. The heart-shaped pendant is pronged set with 24 fiery round diamonds and is attached to a rope chain secured with a spring ring clasp. Your loved one is sure to remember you fondly each time this pendant jewelry is worn. The 17"" long chain pendant is a convenient length to complement many different necklines and styles. It is a sweet reminder to the wearer that you truly care. It makes a thoughtful gift to that special person and it is a lovely additional accessory to a jewelry collection.","['https://i5.walmartimages.com/asr/50461eab-a843-475a-bc80-0e0f9812b6a8_1.78281057f4f27e1b33506eef8eddc2e7.jpeg?odnHeight=450&odnWidth=450&odnBg=FFFFFF', 'https://i5.walmartimages.com/asr/cf769ada-cacc-468d-9854-3dd64e330469_1.e14b8d8b455517fa18f6b7ef234ead0b.jpeg?odnHeight=450&odnWidth=450&odnBg=FFFFFF']",Available,750001422898.0
40998576,"Miabella 8-8.5mm White Button Cultured Freshwater Pearl and Diamond Accent Sterling Silver Infinity Heart Pendant, 18",73.99,"Make a statement with the Miabella 8-8.5mm Cultured Freshwater Pearl Sterling Silver Heart Pendant. It's a gorgeous addition to any jewelry collection. This lovely diamond accent infinity heart pendant pairs nicely with most attire, from casual to formal wear. Give it as a gift or add to your personal accessories. With lustrous sterling silver, this piece is versatile and timeless. An infinity motif melts into a diamond-studded heart with an iridescent white freshwater button pearl at its center. The pendant provides a gorgeous symbol of endless love and devotion. Each of the 18 sparkling white diamonds (G-H, I2-I3) is round-cut and prong-set to showcase its inherent beauty. This white button pearl heart pendant comes on an 18"" cable chain, which is just the right length to wear with most necklines. It has a secure and easy-to-use spring-ring closure.","Make a statement with the Miabella 8-8.5mm Cultured Freshwater Pearl Sterling Silver Heart Pendant. It's a gorgeous addition to any jewelry collection. This lovely diamond accent infinity heart pendant pairs nicely with most attire, from casual to formal wear. Give it as a gift or add to your personal accessories. With lustrous sterling silver, this piece is versatile and timeless. An infinity motif melts into a diamond-studded heart with an iridescent white freshwater button pearl at its center. The pendant provides a gorgeous symbol of endless love and devotion. Each of the 18 sparkling white diamonds (G-H, I2-I3) is round-cut and prong-set to showcase its inherent beauty. This white button pearl heart pendant comes on an 18"" cable chain, which is just the right length to wear with most necklines. It has a secure and easy-to-use spring-ring closure.","['https://i5.walmartimages.com/asr/95be41ce-7dc1-43ed-b944-d17e70d0ffea_1.5ba11be4225df35932180bc0b27f5174.jpeg?odnHeight=450&odnWidth=450&odnBg=FFFFFF', 'https://i5.walmartimages.com/asr/2c0bec94-2833-4b9a-afd6-d2c8c6d98191_1.ae4ba9dd1a3cc5f934862973c157e914.jpeg?odnHeight=450&odnWidth=450&odnBg=FFFFFF', 'https://i5.walmartimages.com/asr/378ef2c9-86d0-4f5c-9db8-4250cb379b9b_1.101a770cf93ca07ad1e958182a290b68.jpeg?odnHeight=450&odnWidth=450&odnBg=FFFFFF', 'https://i5.walmartimages.com/asr/2acea802-1ceb-40fa-994f-072872ba2d00_1.d74bbf4a5cdf595c9510541c294fa789.jpeg?odnHeight=450&odnWidth=450&odnBg=FFFFFF']",Available,750005706178.0
36220444,Miabella 8mm-8.5mm White Round Cultured Freshwater Pearl 10kt Yellow Gold Bypass Ring,168.99,"Crafted in lustrous yellow gold, this Miabella freshwater pearl bypass ring is an exquisite symbol of your enduring love. Featuring a white round freshwater pearl in the center, this fantastic ring is enhanced an ""S"" design along the sides of the highly polished band.","Crafted in lustrous yellow gold, this Miabella freshwater pearl bypass ring is an exquisite symbol of your enduring love. Featuring a white round freshwater pearl in the center, this fantastic ring is enhanced an ""S"" design along the sides of the highly polished band.","['https://i5.walmartimages.com/asr/63081f4b-ae98-4f72-8dad-389422fb8026_1.052b3cd20d653f902e98dbdfd7ed8c84.jpeg?odnHeight=450&odnWidth=450&odnBg=FFFFFF', 'https://i5.walmartimages.com/asr/57a95c1f-bb4f-4b15-ad09-5da809bc20d6_1.47b21455f66f411cbdbc653a858b5283.jpeg?odnHeight=450&odnWidth=450&odnBg=FFFFFF', 'https://i5.walmartimages.com/asr/cea0bc6f-a2fc-4d5d-82fc-3c93558bbe7c_1.c28cdff60d759d8802495d8400c9d383.jpeg?odnHeight=450&odnWidth=450&odnBg=FFFFFF', 'https://i5.walmartimages.com/asr/d43e6aed-ebf7-4cc9-a502-67b962c22e6d_1.d550f6bb51704a6cf8050a67b700867c.jpeg?odnHeight=450&odnWidth=450&odnBg=FFFFFF', 'https://i5.walmartimages.com/asr/578155c4-6670-4d4c-b75f-8c6f74d5560e_1.2da2009632b30fcb9809cc44a265d939.jpeg?odnHeight=450&odnWidth=450&odnBg=FFFFFF', 'https://i5.walmartimages.com/asr/75cef9bd-1452-4bed-b374-1c2c58162864_1.0939293dba9a44dc5badeb11d09428d3.jpeg?odnHeight=450&odnWidth=450&odnBg=FFFFFF']",Available,750002776846.0
31960850,Miabella Diamond Accent 10kt White Gold Interlocking-Heart Ring,141.99,"This Miabella Diamond Accent Interlocking-Heart Ring is crafted in lustrous white gold. Featuring four open hearts linked together, the fashion ring twinkles with five round, pave-set diamonds (G-H, I2-I3).","This Miabella Diamond Accent Interlocking-Heart Ring is crafted in lustrous white gold. Featuring four open hearts linked together, the fashion ring twinkles with five round, pave-set diamonds (G-H, I2-I3).","['https://i5.walmartimages.com/asr/d2577649-e760-497c-90c5-e0b82ed9b91e_1.7dc859f8f135060af0ef5f14489f543b.jpeg?odnHeight=450&odnWidth=450&odnBg=FFFFFF', 'https://i5.walmartimages.com/asr/28ed5e5d-71f1-46ee-925e-24415cbcae6a_1.4c0f79db2d49a90a2f6677067e2f5405.jpeg?odnHeight=450&odnWidth=450&odnBg=FFFFFF', 'https://i5.walmartimages.com/asr/a9116ba2-5664-41ed-b2a7-a5ffc907479e_1.f5c97cc66884b124dec49c8ad4ace5cd.jpeg?odnHeight=450&odnWidth=450&odnBg=FFFFFF']",Available,70935539050.0
36802176,"Miabella Diamond Accent 10kt White Gold Heart Pendant, 17",144.99,"This marvelous Miabella White Gold Diamond Heart Pendant will lend an eye-catching touch of sparkle to her look. Crafted in lustrous white gold, the necklace features 21 round-cut, prong-set diamond accents. The white gold heart pendant is suspended from a 17"" rope chain that will nicely accentuate most necklines. It is secured with a spring ring clasp for secure wear. The neutral coloring of this piece will complement most ensembles. The 10kt white gold diamond pendant can dress up a casual jeans outfit or accompany elegant evening wear. It makes a gorgeous gift for birthdays, anniversaries and other special occasions.","This marvelous Miabella White Gold Diamond Heart Pendant will lend an eye-catching touch of sparkle to her look. Crafted in lustrous white gold, the necklace features 21 round-cut, prong-set diamond accents. The white gold heart pendant is suspended from a 17"" rope chain that will nicely accentuate most necklines. It is secured with a spring ring clasp for secure wear. The neutral coloring of this piece will complement most ensembles. The 10kt white gold diamond pendant can dress up a casual jeans outfit or accompany elegant evening wear. It makes a gorgeous gift for birthdays, anniversaries and other special occasions.","['https://i5.walmartimages.com/asr/68011d17-a459-44a5-823f-c822235ded6d_1.9895c89f00bd8743fe99b511b5572b13.jpeg?odnHeight=450&odnWidth=450&odnBg=FFFFFF', 'https://i5.walmartimages.com/asr/c19389fa-db24-42a6-8e19-e5dc16c46f88_1.f8319cb9722ce290b71e5076187def1e.jpeg?odnHeight=450&odnWidth=450&odnBg=FFFFFF', 'https://i5.walmartimages.com/asr/3ea15f3a-0136-4c35-8030-99b1151ead86_1.7ebe4a43188d70de4c0b995b6825b584.jpeg?odnHeight=450&odnWidth=450&odnBg=FFFFFF', 'https://i5.walmartimages.com/asr/06e6a8fb-7285-4653-9ef5-57295fee514f_1.9f60df75d983ee3dbad44541effe8804.jpeg?odnHeight=450&odnWidth=450&odnBg=FFFFFF', 'https://i5.walmartimages.com/asr/abb41ba7-a11a-4ace-a637-963555604901_1.ebe3de10f205a20279cacbcd46f9975f.jpeg?odnHeight=450&odnWidth=450&odnBg=FFFFFF', 'https://i5.walmartimages.com/asr/db9ca37f-5cb6-456f-893a-acb5c8b4b751_1.c35d5faf7f8592fc199ee6e1acb16869.jpeg?odnHeight=450&odnWidth=450&odnBg=FFFFFF']",Available,750002993960.0
46473111,"Miabella White Sapphire-Accent Sterling Silver Bar Women's Necklace, 17 with 1 Extender",52.99,"A beautiful gift to say ""I love you,"" this dazzling Miabella White Sapphire Bar Necklace will lend an eye-catching touch of sparkle to your look. Crafted in lustrous sterling silver, this fantastic necklace features a round-cut (2mm) white sapphire gemstone. This pretty necklace comes with a 17-inch chain with one-inch extender cable chain and is secured with a spring ring clasp.","A beautiful gift to say ""I love you,"" this dazzling Miabella White Sapphire Bar Necklace will lend an eye-catching touch of sparkle to your look. Crafted in lustrous sterling silver, this fantastic necklace features a round-cut (2mm) white sapphire gemstone. This pretty necklace comes with a 17-inch chain with one-inch extender cable chain and is secured with a spring ring clasp.","['https://i5.walmartimages.com/asr/004253a5-5cbf-4d87-bf54-b97a935865e4_1.0186ee52ec2cc6dc443e855468ae6206.jpeg?odnHeight=450&odnWidth=450&odnBg=FFFFFF', 'https://i5.walmartimages.com/asr/0548c70c-761d-4b73-bff5-92ce95856713_1.aaf572b13a44cdd368f6168144a46d20.jpeg?odnHeight=450&odnWidth=450&odnBg=FFFFFF', 'https://i5.walmartimages.com/asr/d2db0ca8-7942-4fea-be59-f360da305e91_1.9274ae878bb26b260b0d673bc333cbfa.jpeg?odnHeight=450&odnWidth=450&odnBg=FFFFFF', 'https://i5.walmartimages.com/asr/83401a39-f4bc-472d-937c-9bb52fea6d62_1.7e99beeb0d28811a2ddaecdd25fd90dd.jpeg?odnHeight=450&odnWidth=450&odnBg=FFFFFF', 'https://i5.walmartimages.com/asr/e495bb14-736b-40c8-ad19-c16d43d8363e_1.ef556296628b3231f8e191b46c269cd4.jpeg?odnHeight=450&odnWidth=450&odnBg=FFFFFF', 'https://i5.walmartimages.com/asr/1e399905-d9fd-4db0-a275-80fae9571f27_1.8f0da585d6281d8fc985b060cc9b7791.jpeg?odnHeight=450&odnWidth=450&odnBg=FFFFFF']",Available,750004896436.0
31962197,Miabella 1/10 Carat T.W. Diamond 10kt White Gold Cluster Ring,257.99,"This Miabella Diamond Cluster Ring features a beveled square centerpiece adorned with eight icy round, pave-set diamonds (G-H, I1-I2). Accented with diamond illusion detailing, the fashion ring shimmers in lustrous white gold.","This Miabella Diamond Cluster Ring features a beveled square centerpiece adorned with eight icy round, pave-set diamonds (G-H, I1-I2). Accented with diamond illusion detailing, the fashion ring shimmers in lustrous white gold.","['https://i5.walmartimages.com/asr/373806cc-15df-40e7-83a6-69691ea6dbae_1.fc73a62318d0b80291a1dbf60ef26d6b.jpeg?odnHeight=450&odnWidth=450&odnBg=FFFFFF', 'https://i5.walmartimages.com/asr/2ed7f23f-03d6-40bc-b1c7-e4eb93746d99_1.8c3b32705c55f18b8f8e3e40cf07090b.jpeg?odnHeight=450&odnWidth=450&odnBg=FFFFFF', 'https://i5.walmartimages.com/asr/9c207f9c-3f9f-4f7f-a05a-53af1bb1591b_1.cd40699f6c15df56aaa9b2c6c9c28578.jpeg?odnHeight=450&odnWidth=450&odnBg=FFFFFF', 'https://i5.walmartimages.com/asr/af14bb3d-6a02-4c4a-aab3-1fec1d933f03_1.30bbec60986ab558bbaf20b94a52a16f.jpeg?odnHeight=450&odnWidth=450&odnBg=FFFFFF']",Available,70936574050.0
36932106,Miabella 1/7 Carat T.W. Diamond 10kt White Gold Cocktail Ring,290.99,"This Miabella Diamond Fashion Ring will lend an eye-catching touch of sparkle to your look. Crafted in white gold, this ring features a total of 17 round-cut, prong and pave-set diamonds (G-H, I2-I3) in a stylish design.","This Miabella Diamond Fashion Ring will lend an eye-catching touch of sparkle to your look. Crafted in white gold, this ring features a total of 17 round-cut, prong and pave-set diamonds (G-H, I2-I3) in a stylish design.","['https://i5.walmartimages.com/asr/29f77222-cfc3-4bad-86c6-6b217588690b_1.6189aeacb215aa32db64954e39c63dcb.jpeg?odnHeight=450&odnWidth=450&odnBg=FFFFFF', 'https://i5.walmartimages.com/asr/91c9c383-99d7-4b47-876b-fb4687ea37c9_1.86583db512fc9af112e5381e2ebb4b13.jpeg?odnHeight=450&odnWidth=450&odnBg=FFFFFF', 'https://i5.walmartimages.com/asr/b0e41c17-e1cf-44a2-b252-da984e9b1806_1.033c7fdeda4a22677eabb04ea2aeebb8.jpeg?odnHeight=450&odnWidth=450&odnBg=FFFFFF', 'https://i5.walmartimages.com/asr/7bf213e1-e025-40a1-8ba8-fccb8b5a1abc_1.d43b74803bcab6043113998106aaadaf.jpeg?odnHeight=450&odnWidth=450&odnBg=FFFFFF']",Available,750003127296.0
21644540,Tangelo 1-3/4 Carat T.G.W. Created Blue and White Sapphire Sterling Silver Engagement Ring,53.99,"Say ""I love you"" with this unique and magnificent engagement ring in sterling silver. A vintage inspired design with round-cut, lab-created sapphire gemstones makes this ring the perfect one. The unique vintage design is sure to attract compliments and turn heads!","Say ""I love you"" with this unique and magnificent engagement ring in sterling silver. A vintage inspired design with round-cut, lab-created sapphire gemstones makes this ring the perfect one. The unique vintage design is sure to attract compliments and turn heads!","['https://i5.walmartimages.com/asr/0d25c58f-3e00-42c9-bf52-d3f99068084a_1.d6f3210dd5a4ca5a98f5e172f31851cb.jpeg?odnHeight=450&odnWidth=450&odnBg=FFFFFF', 'https://i5.walmartimages.com/asr/12b68886-fbb4-4eb0-902b-004c244444e3_1.ef87c3057d3a3f37dfd831a9eeb3c120.jpeg?odnHeight=450&odnWidth=450&odnBg=FFFFFF', 'https://i5.walmartimages.com/asr/829ea229-b05a-4c66-9ca4-29a655024ac6_1.b25df514569ef27aae6d0c0a0f64bb0a.jpeg?odnHeight=450&odnWidth=450&odnBg=FFFFFF', 'https://i5.walmartimages.com/asr/9f06a23b-9188-46f8-8079-98be2869f807_1.9f46949183433c375ae935473f8356a7.jpeg?odnHeight=450&odnWidth=450&odnBg=FFFFFF', 'https://i5.walmartimages.com/asr/b1c778eb-b7ca-4dcf-85db-3b2007fc2c63_1.1a601763913109c4666fffe5da721718.jpeg?odnHeight=450&odnWidth=450&odnBg=FFFFFF', 'https://i5.walmartimages.com/asr/2c70dc21-3be8-4cf9-a9c9-9e976359195a_1.d6eac9174845edb31e656885fdc95c91.jpeg?odnHeight=450&odnWidth=450&odnBg=FFFFFF']",Available,70663919056.0
21644595,Miabella 1/4 Carat T.W. Round Diamond 3-Piece Bridal Set in Sterling Silver,211.99,"Make your proposal a moment to remember with this Round Diamond Bridal Set. The engagement ring features a single, round-cut white diamond set in a six-prong setting surrounded by twelve diamonds and flanked by another four on each side. This set comes with two matching bands, which fit snugly on each side of the engagement ring. Since you're getting the engagement ring and wedding band in one step, bridal sets make shopping for the perfect ring easy. Just like you and your wife to be, the rings are already perfectly matched. This 3-piece bridal set is crafted in fine sterling silver that offsets each diamond with a rich glow.","Make your proposal a moment to remember with this Round Diamond Bridal Set. The engagement ring features a single, round-cut white diamond set in a six-prong setting surrounded by twelve diamonds and flanked by another four on each side. This set comes with two matching bands, which fit snugly on each side of the engagement ring. Since you're getting the engagement ring and wedding band in one step, bridal sets make shopping for the perfect ring easy. Just like you and your wife to be, the rings are already perfectly matched. This 3-piece bridal set is crafted in fine sterling silver that offsets each diamond with a rich glow.","['https://i5.walmartimages.com/asr/5a6f0958-037a-4a59-aba2-7e017fc67a6e_1.f72b0ce1298de230f1dc3643fa41cea1.jpeg?odnHeight=450&odnWidth=450&odnBg=FFFFFF', 'https://i5.walmartimages.com/asr/d1ff087c-e4d7-424a-a8ea-f6702fe16be6_1.6ff4f29e7d678e9151a92b78863e7c75.jpeg?odnHeight=450&odnWidth=450&odnBg=FFFFFF', 'https://i5.walmartimages.com/asr/13311b5c-9015-493a-ad32-a19296164e15_1.60411990bbd664c0168f7b2784d039c3.jpeg?odnHeight=450&odnWidth=450&odnBg=FFFFFF', 'https://i5.walmartimages.com/asr/ed82f355-6d22-4e8e-946b-17a1af5f9766_1.de5dca616d5f592f0210400d166f45df.jpeg?odnHeight=450&odnWidth=450&odnBg=FFFFFF', 'https://i5.walmartimages.com/asr/76a3ea2e-3a2e-4b1f-b5e3-860ba12de6f1_1.5bc7d844b29b9bd37fb32b0228d77e4f.jpeg?odnHeight=450&odnWidth=450&odnBg=FFFFFF', 'https://i5.walmartimages.com/asr/643a5ae0-0282-4052-bbc4-4dbf16e722ad_1.c2818dea0254615a54cd26eed7bad24e.jpeg?odnHeight=450&odnWidth=450&odnBg=FFFFFF']",Available,70663803058.0
17471756,Miabella Men's 10kt Two-Tone Gold Diamond Illusion Wedding Band,194.99,"This Men's Wedding Band from Miabella is timeless and elegant. Crafted in two-tone gold, this ring features 4 diamond illusions on its top, giving it a touch of sparkle. This wedding band is available in sizes 9 to 12.","This Men's Wedding Band from Miabella is timeless and elegant. Crafted in two-tone gold, this ring features 4 diamond illusions on its top, giving it a touch of sparkle. This wedding band is available in sizes 9 to 12.",['https://i5.walmartimages.com/asr/4cb99027-9310-483c-9fd8-227bb686ea87_1.19787bf0016980953d4529d8209a7d0e.jpeg?odnHeight=450&odnWidth=450&odnBg=FFFFFF'],Available,73624091150.0
